<?xml version="1.0" encoding="UTF-8"?>
<Beer xmlns:xsi="http://www.w3.org/2001/XMLSchema-instance" xsi:noNamespaceSchemaLocation="xsd/beer.xsd">
    <beerItem id="1" name="Stout" type="темне" al="алкогольне" manufacturer="Brewery A">
        <ingredients>
            <ingredient>Water</ingredient>
            <ingredient>Barley</ingredient>
            <ingredient>Hops</ingredient>
            <ingredient>Yeast</ingredient>
        </ingredients>
        <chars>
            <abv>6.5</abv>
            <transparency>20</transparency>
            <filtered>Yes</filtered>
            <nutritionalValue>150</nutritionalValue>
            <packaging>
                <volume>0.5</volume>
                <material>Glass</material>
            </packaging>
        </chars>
    </beerItem>
    <beerItem id="2" name="Lager" type="світле" al="алкогольне" manufacturer="Brewery B">
        <ingredients>
            <ingredient>Water</ingredient>
            <ingredient>Rice</ingredient>
            <ingredient>Hops</ingredient>
            <ingredient>Yeast</ingredient>
        </ingredients>
        <chars>
            <abv>5.0</abv>
            <transparency>70</transparency>
            <filtered>No</filtered>
            <nutritionalValue>130</nutritionalValue>
            <packaging>
                <volume>0.33</volume>
                <material>Can</material>
            </packaging>
        </chars>
    </beerItem>
    <beerItem id="3" name="Non-Alcoholic Wheat" type="живе" al="безалкогольне" manufacturer="Brewery C">
        <ingredients>
            <ingredient>Water</ingredient>
            <ingredient>Wheat</ingredient>
            <ingredient>Hops</ingredient>
            <ingredient>Yeast</ingredient>
        </ingredients>
        <chars>
            <abv>0.0</abv>
            <transparency>60</transparency>
            <filtered>Yes</filtered>
            <nutritionalValue>90</nutritionalValue>
            <packaging>
                <volume>0.5</volume>
                <material>Plastic</material>
            </packaging>
        </chars>
    </beerItem>
</Beer>
